514693302,XP_004994223.1, integrin linked kinase [Salpingoeca rosetta],1.80616e-14
761911057,XP_011404829.1, PREDICTED: ankyrin repeat and SAM domain-containing protein 4B-like [Amphimedon queenslandica],1.94443e-30
34304383,NP_775748.2, Usher syndrome type-1G protein isoform 1 [Homo sapiens],0.0
156368165,XP_001627566.1, predicted protein [Nematostella vectensis],6.44513e-68
828212065,XP_012558872.1, PREDICTED: uncharacterized protein LOC100204458, partial [Hydra vulgaris],1.67499e-15
115803092,XP_783343.2, PREDICTED: Usher syndrome type-1G protein homolog [Strongylocentrotus purpuratus],9.22941e-44
20129939,NP_610829.1, scaffold protein containing ankyrin repeats and SAM domain, isoform A [Drosophila melanogaster] >gi,8.04683e-65
961125294,XP_014783988.1, PREDICTED: ankyrin repeat and SAM domain-containing protein 4B-like [Octopus bimaculoides],4.73917e-43
919082261,XP_013422199.1, PREDICTED: Usher syndrome type-1G protein-like [Lingula anatina],4.39017e-108
